{
  "initialScene": "hero-interior",
  "scenes": [
    {
      "activation": "exclusive",
      "entities": [
        "bed.deck.lower",
        "bed.deck.upper",
        "bed.post.01",
        "bed.post.02",
        "bed.post.03",
        "bed.post.04",
        "bed.rail.back.lower",
        "bed.rail.back.upper",
        "bed.rail.foot",
        "bed.rail.front.lower",
        "bed.rail.front.upper",
        "bed.rail.head",
        "cabinet.back",
        "cabinet.right",
        "camera.main",
        "contact.bed",
        "contact.cabinets",
        "contact.crates",
        "contact.door-and-accent",
        "corridor.back.glow",
        "corridor.ceiling",
        "corridor.floor",
        "corridor.wall.left",
        "corridor.wall.right",
        "crate.wood.01",
        "crate.wood.02",
        "crate.wood.03",
        "crate.yellow",
        "debris.01",
        "debris.02",
        "debris.03",
        "debris.04",
        "door.fallen",
        "doorway.frame.left",
        "doorway.frame.right",
        "doorway.frame.top",
        "lamp.fixture",
        "light.corridor",
        "light.lamp",
        "light.window.fill",
        "light.window.key",
        "pillar.center",
        "pipe.ceiling.01",
        "pipe.ceiling.02",
        "puddle.foreground",
        "puddle.window",
        "room.ceiling",
        "room.floor",
        "room.wall.back.band.left",
        "room.wall.back.band.right",
        "room.wall.back.left",
        "room.wall.back.right",
        "room.wall.back.upper",
        "room.wall.front",
        "room.wall.left.lower",
        "room.wall.left.pier.back",
        "room.wall.left.pier.front",
        "room.wall.left.pier.middle",
        "room.wall.left.upper",
        "room.wall.right",
        "visual.provenance",
        "window.front.frame.back",
        "window.front.frame.bottom",
        "window.front.frame.front",
        "window.front.frame.top",
        "window.front.glow",
        "window.front.mullion.horizontal",
        "window.front.mullion.vertical",
        "window.rear.frame.back",
        "window.rear.frame.bottom",
        "window.rear.frame.front",
        "window.rear.frame.top",
        "window.rear.glow",
        "window.rear.mullion.horizontal",
        "window.rear.mullion.vertical"
      ],
      "id": "hero-interior",
      "kind": "level",
      "systems": [
        "move-player-to-goal"
      ]
    }
  ],
  "schema": "threenative.scenes",
  "version": "0.1.0"
}
